{
  "schema_version": 1,
  "module_id": "demon_slayer",
  "name": "斩妖除魔",
  "version": "1.0.1",
  "core_compatibility": ">=1.0.0 <2.0.0",
  "release_tag": "modules-2026.08.02",
  "asset_name": "demon_slayer-1.0.1.zip",
  "dependencies": [],
  "optional_dependencies": [
    "conversation"
  ],
  "conflicts": [],
  "permissions": [
    "local_state"
  ],
  "data_policy": "preserve_on_uninstall",
  "requires_restart": true
}
