{
  "schema_version": 1,
  "module_id": "gpt_sovits_engine_provider",
  "name": "GPT-SoVITS Engine Provider",
  "version": "1.0.2",
  "core_compatibility": ">=1.0.0 <2.0.0",
  "release_tag": "modules-2026.08.12",
  "asset_name": "gpt_sovits_engine_provider-1.0.2.zip",
  "dependencies": [
    "voice"
  ],
  "optional_dependencies": [],
  "conflicts": [],
  "permissions": [
    "local_state"
  ],
  "data_policy": "preserve_on_uninstall",
  "requires_restart": false
}
