{
  "schema_version": 1,
  "module_id": "focus",
  "name": "专注计时",
  "version": "1.1.1",
  "core_compatibility": ">=1.0.0 <2.0.0",
  "release_tag": "modules-2026.08.02",
  "asset_name": "focus-1.1.1.zip",
  "dependencies": [],
  "optional_dependencies": [],
  "conflicts": [],
  "permissions": [
    "local_state"
  ],
  "data_policy": "preserve_on_uninstall",
  "requires_restart": true
}
