{
  "schema_version": 1,
  "module_id": "voice_pack_distribution",
  "name": "Voice Pack 分发",
  "version": "1.0.1",
  "core_compatibility": ">=1.0.0 <2.0.0",
  "release_tag": "modules-2026.08.02",
  "asset_name": "voice_pack_distribution-1.0.1.zip",
  "dependencies": [
    "voice_pack_registry"
  ],
  "optional_dependencies": [],
  "conflicts": [],
  "permissions": [
    "local_state",
    "network_download"
  ],
  "data_policy": "preserve_on_uninstall",
  "requires_restart": true
}
