{
  "schema_version": 1,
  "module_id": "rss_intel",
  "name": "RSS/Atom 情报来源",
  "version": "1.0.0",
  "core_compatibility": ">=1.0.0 <2.0.0",
  "release_tag": "modules-2026.08.02",
  "asset_name": "rss_intel-1.0.0.zip",
  "dependencies": [
    "intel_sources"
  ],
  "optional_dependencies": [],
  "conflicts": [],
  "permissions": [],
  "data_policy": "preserve_on_uninstall",
  "requires_restart": true
}
