{
  "schema_version": 1,
  "module_id": "calendar",
  "name": "日历备忘与修炼记录",
  "version": "1.0.0",
  "core_compatibility": ">=1.0.0 <2.0.0",
  "release_tag": "modules-2026.08.02",
  "asset_name": "calendar-1.0.0.zip",
  "dependencies": [],
  "optional_dependencies": [],
  "conflicts": [],
  "permissions": [
    "local_state"
  ],
  "data_policy": "preserve_on_uninstall",
  "requires_restart": true
}
