{
  "schema_version": 1,
  "module_id": "conversation",
  "name": "LLM 对话与模型方案",
  "version": "1.0.2",
  "core_compatibility": ">=1.0.0 <2.0.0",
  "release_tag": "modules-2026.08.02",
  "asset_name": "conversation-1.0.2.zip",
  "dependencies": [],
  "optional_dependencies": [],
  "conflicts": [],
  "permissions": [
    "local_state"
  ],
  "data_policy": "preserve_on_uninstall",
  "requires_restart": true
}
