{
  "schema_version": 1,
  "module_id": "youtube",
  "name": "YouTube 频道采集",
  "version": "1.0.1",
  "core_compatibility": ">=1.0.0 <2.0.0",
  "release_tag": "modules-2026.08.02",
  "asset_name": "youtube-1.0.1.zip",
  "dependencies": [
    "intel_sources"
  ],
  "optional_dependencies": [],
  "conflicts": [],
  "permissions": [],
  "data_policy": "preserve_on_uninstall",
  "requires_restart": true
}
