{
  "schema_version": 1,
  "module_id": "intel_sources",
  "name": "情报来源管理",
  "version": "1.1.6",
  "core_compatibility": ">=1.0.0 <2.0.0",
  "release_tag": "modules-2026.08.08",
  "asset_name": "intel-sources-1.1.6.zip",
  "dependencies": [],
  "optional_dependencies": [],
  "conflicts": [],
  "permissions": [
    "local_state"
  ],
  "data_policy": "preserve_on_uninstall",
  "requires_restart": true
}
